[
  {"id":"lagna-mesha","rule":"Lagna in Mesha (1st-house lord Mars, fire, movable; Mars also rules the 8th house)","source":"Brihat Jataka","level":1,"review":"draft","params":[],"text":"मेष लग्न होखला पर मंगल पहिला घर के स्वामी बाड़न आ कुंडली एगो चर अग्नि राशि से पढ़ल जाला। उदय राशि ओह रुख के बतावेला जे आदमी नया हालत में ले के आवेला: इहाँ ई अक्सर सोझ बात, जल्दी शुरुआत आ सोच-विचार से पहिले कर डाले के पसंद के रूप में देखाला। ऊर्जा झोंका में आवेला आ खुल के खरचा होला। एह लग्न खातिर मंगल आठवाँ घर के भी स्वामी बाड़न, एह से ओही जोश एह बात खातिर पढ़ल जाला कि अंत आ अचके आइल बदलाव कइसे निभावल जाला। सोच-विचार के सवाल जोर के ना, गति के बा।"},
  {"id":"lagna-vrishabha","rule":"Lagna in Vrishabha (1st-house lord Venus, earth, fixed; Venus also rules the 6th house)","source":"Brihat Jataka","level":1,"review":"draft","params":[],"text":"वृषभ लग्न होखला पर शुक्र पहिला घर के स्वामी बाड़न आ कुंडली एगो स्थिर पृथ्वी राशि से पढ़ल जाला। उदय राशि अक्सर एगो शांत, सोच-समझ के चले वाला ढंग, सुख आ निरंतरता के पसंद, आ धीमा बाकिर दृढ़ फैसला लेवे के तरीका के रूप में देखाला। पहिला छाप चौंकावे वाला ना, थिर होला। इहाँ शुक्र छठा घर के भी स्वामी बाड़न, एह से आराम के ओही पसंद दिनचर्या आ ओह काम के सामने पढ़ल जाला जे हर हाल में करहीं के पड़ेला। सवाल ई बा कि थिरता कहाँ हिले के अनिच्छा बन जाला।"},
  {"id":"lagna-mithuna","rule":"Lagna in Mithuna (1st-house lord Mercury, air, dual; Mercury also rules the 4th house)","source":"Brihat Jataka","level":1,"review":"draft","params":[],"text":"मिथुन लग्न होखला पर बुध पहिला घर के स्वामी बाड़न आ कुंडली एगो द्विस्वभाव वायु राशि से पढ़ल जाला। उदय राशि अक्सर एगो तेज, बतकही वाला ढंग के रूप में देखाला जे नया हालत से सवाल, हँसी-मजाक आ एक से बेसी योजना के संगे मिलेला। ध्यान आसानी से एने-ओने जाला आ ठहरे खातिर ओकरा कवनो कारन चाहीं हो सकेला। एह लग्न खातिर बुध चउथा घर के भी स्वामी बाड़न, जे बाहरी चेहरा के घर-परिवार आ भीतरी ठहराव से जोड़ेला। एकरा एह बात खातिर पढ़ल जाला कि जिज्ञासा के कुंद कइले बिना ओकरा ढाँचा कइसे दिहल जाला।"},
  {"id":"lagna-karka","rule":"Lagna in Karka (1st-house lord Moon, water, movable)","source":"Brihat Jataka","level":1,"review":"draft","params":[],"text":"कर्क लग्न होखला पर चंद्र पहिला घर के स्वामी बाड़न आ कुंडली एगो चर जल राशि से पढ़ल जाला। उदय राशि अक्सर एगो संवेदनशील, रक्षा करे वाला ढंग के रूप में देखाला जे बोले से पहिले माहौल भाँप लेला आ याद राखेला कि लोग के संगे कइसन बरताव भइल। मन के मिजाज दिन के बेसी लग्न के तुलना में बेसी रंग देला। काहे कि चंद्र सबसे तेज चलेलन, इहाँ पहिला घर चंद्र के आपन राशि आ नक्षत्र के संगे मिला के बारीकी से पढ़ल जाला। सोच-विचार के सवाल ई बा कि हर केहू के मौसम आपन ऊपर लिहले बिना देखभाल कइसे दिहल जाला।"},
  {"id":"lagna-simha","rule":"Lagna in Simha (1st-house lord Sun, fire, fixed)","source":"Brihat Jataka","level":1,"review":"draft","params":[],"text":"सिंह लग्न होखला पर सूर्य पहिला घर के स्वामी बाड़न आ कुंडली एगो स्थिर अग्नि राशि से पढ़ल जाला। उदय राशि अक्सर एगो गरमजोशी भरल, आत्मविश्वास वाला ढंग के रूप में देखाला जे काम के ठीक से करत देखल जाइल पसंद करेला आ जिम्मेदारी के खुल के उठावेला। गर्व आ उदारता लगे-लगे बइठेला। सिंह लग्न खातिर सूर्य खाली एही एगो घर के स्वामी बाड़न, एह से उनकर राशि आ बल-स्थिति कुंडली के गुरुत्व-केंद्र के रूप में पढ़ल जाला। सवाल ई बा कि मान्यता कइसे माँगल जाला आ कइसे बाँटल जाला।"},
  {"id":"lagna-kanya","rule":"Lagna in Kanya (1st-house lord Mercury, earth, dual; Mercury also rules the 10th house)","source":"Brihat Jataka","level":1,"review":"draft","params":[],"text":"कन्या लग्न होखला पर बुध पहिला घर के स्वामी बाड़न आ कुंडली एगो द्विस्वभाव पृथ्वी राशि से पढ़ल जाला। उदय राशि अक्सर एगो बारीक, पैना नजर वाला ढंग, सामने जे बा ओकरा बढ़िया करे के आदत, आ जेतना देखावल जा सके ओकरा से बेसी दावा ना करे के हिचक के रूप में देखाला। विनय आ कड़ा मानदंड संगे-संगे चलेला। इहाँ बुध दसवाँ घर के भी स्वामी बाड़न, एह से बाहरी चेहरा आ कामकाज एके धागा के रूप में पढ़ल जाला। सवाल ई बा कि ऊँच मानदंड काम के आगे बढ़ावेला कि रोक देला।"},
  {"id":"lagna-tula","rule":"Lagna in Tula (1st-house lord Venus, air, movable; Venus also rules the 8th house)","source":"Brihat Jataka","level":1,"review":"draft","params":[],"text":"तुला लग्न होखला पर शुक्र पहिला घर के स्वामी बाड़न आ कुंडली एगो चर वायु राशि से पढ़ल जाला। उदय राशि अक्सर एगो शिष्ट, संतुलन साधे वाला ढंग के रूप में देखाला जे जवाब देवे से पहिले दूसरा पक्ष के तौलेला आ जीत से बेसी सहमति पसंद करेला। आकर्षण सहज बा; फैसला लेवे के क्षमता सीखल जाला। एह लग्न खातिर शुक्र आठवाँ घर के भी स्वामी बाड़न, एह से ऊपर के सहजता ओकरा संगे पढ़ल जाला जे निजी राखल जाला आ जे बाँटल जाला। सोच-विचार के सवाल ई बा कि दूसरा के संगे न्याय में आपन संगे न्याय कइसे शामिल होखे।"},
  {"id":"lagna-vrishchika","rule":"Lagna in Vrishchika (1st-house lord Mars, water, fixed; Mars also rules the 6th house)","source":"Brihat Jataka","level":1,"review":"draft","params":[],"text":"वृश्चिक लग्न होखला पर मंगल पहिला घर के स्वामी बाड़न आ कुंडली एगो स्थिर जल राशि से पढ़ल जाला। उदय राशि अक्सर एगो संकोची, चौकस ढंग के रूप में देखाला जे शुरू में कमे खोलेला आ भरोसा मिल गइला पर पूरा तरह जुट जाला। तीव्रता देखावल ना, भीतर थामल जाला। एह लग्न खातिर मंगल छठा घर के भी स्वामी बाड़न, एह से ई गहिराई रोज के मेहनत, होड़ आ बाधा से निपटे के सामने पढ़ल जाला। सवाल ई बा कि प्रबल भावना दबाव के तरह थामले रहे के बदले थिर उद्देश्य में कइसे बदलल जाला।"},
  {"id":"lagna-dhanu","rule":"Lagna in Dhanu (1st-house lord Jupiter, fire, dual; Jupiter also rules the 4th house)","source":"Brihat Jataka","level":1,"review":"draft","params":[],"text":"धनु लग्न होखला पर गुरु पहिला घर के स्वामी बाड़न आ कुंडली एगो द्विस्वभाव अग्नि राशि से पढ़ल जाला। उदय राशि अक्सर एगो खुला, सिद्धांत वाला ढंग के रूप में देखाला जे घटना में बड़ मतलब खोजेला आ आपन मान्यता बेझिझक कह देला। आशावाद आ खरापन अक्सर संगे-संगे आवेला। एह लग्न खातिर गुरु चउथा घर के भी स्वामी बाड़न, जे बाहरी नजरिया के घर-परिवार, विद्या आ भीतरी जमीन से बान्हेला। एकरा एह बात खातिर पढ़ल जाला कि विश्वास उदार आ दूसरा मत खातिर खुला कइसे बनल रहेला।"},
  {"id":"lagna-makara","rule":"Lagna in Makara (1st-house lord Saturn, earth, movable; Saturn also rules the 2nd house)","source":"Brihat Jataka","level":1,"review":"draft","params":[],"text":"मकर लग्न होखला पर शनि पहिला घर के स्वामी बाड़न आ कुंडली एगो चर पृथ्वी राशि से पढ़ल जाला। उदय राशि अक्सर एगो नाप-तौल के चले वाला, व्यावहारिक ढंग के रूप में देखाला जे खुले में समय लेला आ वादा से बेसी परिनाम पसंद करेला। जिम्मेदारी जल्दी स्वीकार कइल जाला आ चुपचाप निभावल जाला। एह लग्न खातिर शनि दूसरा घर के भी स्वामी बाड़न, एह से ओही सावधानी बोली, परिवार के संसाधन आ बचा के राखल चीज के मामिला में पढ़ल जाला। सवाल ई बा कि कर्तव्य आराम खातिर जगह कइसे छोड़ेला।"},
  {"id":"lagna-kumbha","rule":"Lagna in Kumbha (1st-house lord Saturn, air, fixed; Saturn also rules the 12th house)","source":"Brihat Jataka","level":1,"review":"draft","params":[],"text":"कुंभ लग्न होखला पर शनि पहिला घर के स्वामी बाड़न आ कुंडली एगो स्थिर वायु राशि से पढ़ल जाला। उदय राशि अक्सर एगो अलगा, विचार वाला ढंग के रूप में देखाला जे भीड़ से थोड़ा हट के खड़ा रहेला बाकिर पूरा समूह के परवाह करेला। विचार आ सिद्धांत निजी देखावा से पहिले आवेला। एह लग्न खातिर शनि बारहवाँ घर के भी स्वामी बाड़न, जे बाहरी रूप के एकांत, दूर के जगह आ जे दे दिहल जाला ओकरा से जोड़ेला। एकरा एह बात खातिर पढ़ल जाला कि आजादी आ अपनापन कइसे मिलावल जाला।"},
  {"id":"lagna-meena","rule":"Lagna in Meena (1st-house lord Jupiter, water, dual; Jupiter also rules the 10th house)","source":"Brihat Jataka","level":1,"review":"draft","params":[],"text":"मीन लग्न होखला पर गुरु पहिला घर के स्वामी बाड़न आ कुंडली एगो द्विस्वभाव जल राशि से पढ़ल जाला। उदय राशि अक्सर एगो कोमल, हर हाल में ढल जाए वाला ढंग के रूप में देखाला जे आसपास के मिजाज सोख लेला आ होड़ से बेसी मतलब आ दया पसंद करेला। सीमा नरम हो सकेला। एह लग्न खातिर गुरु दसवाँ घर के भी स्वामी बाड़न, एह से ई ग्रहणशील सुभाव कामकाज आ बाहरी भूमिका के संगे पढ़ल जाला। सोच-विचार के सवाल ई बा कि आपन एगो साफ केंद्र खोए बिना खुलापन कइसे बनवले राखल जाला।"}
]
