[
  {"id":"lagna-mesha","rule":"Lagna in Mesha (1st-house lord Mars, fire, movable; Mars also rules the 8th house)","source":"Brihat Jataka","level":1,"review":"draft","params":[],"text":"मेष लग्न होने पर मंगल पहले भाव के स्वामी हैं और कुंडली एक चर अग्नि राशि से पढ़ी जाती है। उदय राशि उस रुख़ को बताती है जो व्यक्ति नई परिस्थितियों में लेकर आता है: यहाँ यह प्रायः सीधेपन, जल्दी शुरुआत और सोच-विचार से पहले कर डालने की पसंद के रूप में दिखता है। ऊर्जा झोंकों में आती है और खुले तौर पर खर्च होती है। इस लग्न के लिए मंगल आठवें भाव के भी स्वामी हैं, इसलिए वही जोश इस बात के लिए पढ़ा जाता है कि अंत और अचानक आए बदलाव कैसे निभाए जाते हैं। चिंतन का प्रश्न ज़ोर का नहीं, गति का है।"},
  {"id":"lagna-vrishabha","rule":"Lagna in Vrishabha (1st-house lord Venus, earth, fixed; Venus also rules the 6th house)","source":"Brihat Jataka","level":1,"review":"draft","params":[],"text":"वृषभ लग्न होने पर शुक्र पहले भाव के स्वामी हैं और कुंडली एक स्थिर पृथ्वी राशि से पढ़ी जाती है। उदय राशि प्रायः एक शांत, सोच-समझकर चलने वाले ढंग, सुख और निरंतरता की पसंद, और धीमे पर दृढ़ निर्णय लेने के तरीके के रूप में दिखती है। पहली छाप चौंकाने वाली नहीं, स्थिर होती है। यहाँ शुक्र छठे भाव के भी स्वामी हैं, इसलिए सहूलियत की वही पसंद दिनचर्या और उस काम के सामने पढ़ी जाती है जो हर हाल में करना ही होता है। प्रश्न यह है कि स्थिरता कहाँ हिलने की अनिच्छा बन जाती है।"},
  {"id":"lagna-mithuna","rule":"Lagna in Mithuna (1st-house lord Mercury, air, dual; Mercury also rules the 4th house)","source":"Brihat Jataka","level":1,"review":"draft","params":[],"text":"मिथुन लग्न होने पर बुध पहले भाव के स्वामी हैं और कुंडली एक द्विस्वभाव वायु राशि से पढ़ी जाती है। उदय राशि प्रायः एक तेज़, बातूनी ढंग के रूप में दिखती है जो नई परिस्थितियों से प्रश्नों, हँसी-मज़ाक और एक से अधिक योजनाओं के साथ मिलता है। ध्यान आसानी से इधर-उधर जाता है और ठहरने के लिए उसे कोई कारण चाहिए हो सकता है। इस लग्न के लिए बुध चौथे भाव के भी स्वामी हैं, जो सार्वजनिक चेहरे को घर और भीतरी ठहराव से जोड़ता है। इसे इस बात के लिए पढ़ा जाता है कि जिज्ञासा को कुंद किए बिना उसे ढाँचा कैसे दिया जाता है।"},
  {"id":"lagna-karka","rule":"Lagna in Karka (1st-house lord Moon, water, movable)","source":"Brihat Jataka","level":1,"review":"draft","params":[],"text":"कर्क लग्न होने पर चंद्र पहले भाव के स्वामी हैं और कुंडली एक चर जल राशि से पढ़ी जाती है। उदय राशि प्रायः एक संवेदनशील, रक्षा करने वाले ढंग के रूप में दिखती है जो बोलने से पहले माहौल को भाँप लेता है और याद रखता है कि लोगों के साथ कैसा बरताव हुआ। मनोदशा दिन को ज़्यादातर लग्नों की तुलना में अधिक रंग देती है। क्योंकि चंद्र सबसे तेज़ चलते हैं, यहाँ पहला भाव चंद्र की अपनी राशि और नक्षत्र के साथ मिलाकर बारीकी से पढ़ा जाता है। चिंतन का प्रश्न यह है कि हर किसी का मौसम अपने ऊपर लिए बिना देखभाल कैसे दी जाती है।"},
  {"id":"lagna-simha","rule":"Lagna in Simha (1st-house lord Sun, fire, fixed)","source":"Brihat Jataka","level":1,"review":"draft","params":[],"text":"सिंह लग्न होने पर सूर्य पहले भाव के स्वामी हैं और कुंडली एक स्थिर अग्नि राशि से पढ़ी जाती है। उदय राशि प्रायः एक गर्मजोशी भरे, आत्मविश्वासी ढंग के रूप में दिखती है जो काम को ठीक से करते हुए देखा जाना चाहता है और ज़िम्मेदारी को खुले तौर पर उठाता है। गर्व और उदारता पास-पास बैठते हैं। सिंह लग्न के लिए सूर्य केवल इसी एक भाव के स्वामी हैं, इसलिए उनकी राशि और बल-स्थिति कुंडली के गुरुत्व-केंद्र के रूप में पढ़ी जाती है। प्रश्न यह है कि मान्यता कैसे माँगी जाती है और कैसे बाँटी जाती है।"},
  {"id":"lagna-kanya","rule":"Lagna in Kanya (1st-house lord Mercury, earth, dual; Mercury also rules the 10th house)","source":"Brihat Jataka","level":1,"review":"draft","params":[],"text":"कन्या लग्न होने पर बुध पहले भाव के स्वामी हैं और कुंडली एक द्विस्वभाव पृथ्वी राशि से पढ़ी जाती है। उदय राशि प्रायः एक बारीक, पैनी नज़र वाले ढंग, सामने जो है उसे बेहतर करने की आदत, और जितना दिखाया जा सके उससे अधिक दावा न करने की हिचक के रूप में दिखती है। विनय और कड़े मानदंड साथ-साथ चलते हैं। यहाँ बुध दसवें भाव के भी स्वामी हैं, इसलिए सार्वजनिक चेहरा और कार्यक्षेत्र एक ही धागे के रूप में पढ़े जाते हैं। प्रश्न यह है कि ऊँचे मानदंड काम को आगे बढ़ाते हैं या रोक देते हैं।"},
  {"id":"lagna-tula","rule":"Lagna in Tula (1st-house lord Venus, air, movable; Venus also rules the 8th house)","source":"Brihat Jataka","level":1,"review":"draft","params":[],"text":"तुला लग्न होने पर शुक्र पहले भाव के स्वामी हैं और कुंडली एक चर वायु राशि से पढ़ी जाती है। उदय राशि प्रायः एक शिष्ट, संतुलन साधने वाले ढंग के रूप में दिखती है जो जवाब देने से पहले दूसरे पक्ष को तौलता है और जीत से ज़्यादा सहमति को पसंद करता है। आकर्षण स्वाभाविक है; निर्णय लेने की क्षमता सीखी जाती है। इस लग्न के लिए शुक्र आठवें भाव के भी स्वामी हैं, इसलिए सतह की सहजता उसके साथ पढ़ी जाती है जो निजी रखा जाता है और जो साझा किया जाता है। चिंतन का प्रश्न यह है कि दूसरों के साथ न्याय में अपने साथ न्याय कैसे शामिल हो।"},
  {"id":"lagna-vrishchika","rule":"Lagna in Vrishchika (1st-house lord Mars, water, fixed; Mars also rules the 6th house)","source":"Brihat Jataka","level":1,"review":"draft","params":[],"text":"वृश्चिक लग्न होने पर मंगल पहले भाव के स्वामी हैं और कुंडली एक स्थिर जल राशि से पढ़ी जाती है। उदय राशि प्रायः एक संकोची, चौकस ढंग के रूप में दिखती है जो शुरू में कम ही खोलता है और भरोसा मिल जाने पर पूरी तरह जुट जाता है। तीव्रता दिखाई नहीं, भीतर थामी जाती है। इस लग्न के लिए मंगल छठे भाव के भी स्वामी हैं, इसलिए यह गहराई रोज़ के परिश्रम, प्रतिस्पर्धा और बाधाओं से निपटने के सामने पढ़ी जाती है। प्रश्न यह है कि प्रबल भावना दबाव की तरह थामे रहने के बजाय स्थिर उद्देश्य में कैसे बदली जाती है।"},
  {"id":"lagna-dhanu","rule":"Lagna in Dhanu (1st-house lord Jupiter, fire, dual; Jupiter also rules the 4th house)","source":"Brihat Jataka","level":1,"review":"draft","params":[],"text":"धनु लग्न होने पर गुरु पहले भाव के स्वामी हैं और कुंडली एक द्विस्वभाव अग्नि राशि से पढ़ी जाती है। उदय राशि प्रायः एक खुले, सिद्धांतवादी ढंग के रूप में दिखती है जो घटनाओं में बड़ा अर्थ खोजता है और अपनी मान्यताएँ बेझिझक कह देता है। आशावाद और खरापन अक्सर साथ-साथ आते हैं। इस लग्न के लिए गुरु चौथे भाव के भी स्वामी हैं, जो सार्वजनिक दृष्टि को घर, विद्या और भीतरी ज़मीन से बाँधता है। इसे इस बात के लिए पढ़ा जाता है कि विश्वास उदार और दूसरे मतों के लिए खुला कैसे बना रहता है।"},
  {"id":"lagna-makara","rule":"Lagna in Makara (1st-house lord Saturn, earth, movable; Saturn also rules the 2nd house)","source":"Brihat Jataka","level":1,"review":"draft","params":[],"text":"मकर लग्न होने पर शनि पहले भाव के स्वामी हैं और कुंडली एक चर पृथ्वी राशि से पढ़ी जाती है। उदय राशि प्रायः एक नाप-तौल कर चलने वाले, व्यावहारिक ढंग के रूप में दिखती है जो खुलने में समय लेता है और वादों से ज़्यादा परिणामों को पसंद करता है। ज़िम्मेदारी जल्दी स्वीकार की जाती है और चुपचाप निभाई जाती है। इस लग्न के लिए शनि दूसरे भाव के भी स्वामी हैं, इसलिए वही सावधानी वाणी, परिवार के संसाधनों और बचाकर रखी गई चीज़ों के मामलों में पढ़ी जाती है। प्रश्न यह है कि कर्तव्य सहजता के लिए जगह कैसे छोड़ता है।"},
  {"id":"lagna-kumbha","rule":"Lagna in Kumbha (1st-house lord Saturn, air, fixed; Saturn also rules the 12th house)","source":"Brihat Jataka","level":1,"review":"draft","params":[],"text":"कुंभ लग्न होने पर शनि पहले भाव के स्वामी हैं और कुंडली एक स्थिर वायु राशि से पढ़ी जाती है। उदय राशि प्रायः एक अलग-थलग, विचारशील ढंग के रूप में दिखती है जो भीड़ से थोड़ा हटकर खड़ा रहता है पर पूरे समूह की परवाह करता है। विचार और सिद्धांत व्यक्तिगत प्रदर्शन से पहले आते हैं। इस लग्न के लिए शनि बारहवें भाव के भी स्वामी हैं, जो सार्वजनिक स्वरूप को एकांत, दूर के स्थानों और जो दे दिया जाता है उससे जोड़ता है। इसे इस बात के लिए पढ़ा जाता है कि स्वतंत्रता और अपनापन कैसे मिलाए जाते हैं।"},
  {"id":"lagna-meena","rule":"Lagna in Meena (1st-house lord Jupiter, water, dual; Jupiter also rules the 10th house)","source":"Brihat Jataka","level":1,"review":"draft","params":[],"text":"मीन लग्न होने पर गुरु पहले भाव के स्वामी हैं और कुंडली एक द्विस्वभाव जल राशि से पढ़ी जाती है। उदय राशि प्रायः एक कोमल, हर हाल में ढल जाने वाले ढंग के रूप में दिखती है जो आसपास की मनोदशा को सोख लेता है और प्रतिस्पर्धा से ज़्यादा अर्थ और दया को पसंद करता है। सीमाएँ नरम हो सकती हैं। इस लग्न के लिए गुरु दसवें भाव के भी स्वामी हैं, इसलिए यह ग्रहणशील स्वभाव कार्यक्षेत्र और सार्वजनिक भूमिका के साथ पढ़ा जाता है। चिंतन का प्रश्न यह है कि अपना एक स्पष्ट केंद्र खोए बिना खुलापन कैसे बनाए रखा जाता है।"}
]
