[
  {"id":"vrat-ekadashi","rule":"Ekadashi is kept on the day whose sunrise has the eleventh tithi (Smarta), or on the next day for Vaishnavas when Dashami still runs at dawn; parana follows the end of Hari Vasara within the Dwadashi, before a fifth of the day has passed.","source":"Dharmasindhu","level":1,"review":"draft","text":"एकादशी हर चांद्र महीना में दू बेर आवेला, हर पक्ष के एगारहवाँ तिथि के, आ हर एकादशी के आपन नाँव होला। ई दिन अन्न आ दाल छोड़ के बरत राखल जाला; ढेर लोग फल, दूध भा पानी लेला, आ कुछ लोग जेठ के निर्जला एकादशी बिना पानी के राखेला। दिन पाठ, मौन भा विष्णु मंदिर के दरसन में बीतेला। बरत सूर्यास्त पर ना खोलल जाला: पारन अगिला भोरे द्वादशी तिथि के भीतर होला, हरि वासर (द्वादशी के पहिला चौथाई) खतम भइला के बाद आ दिन के पाँचवाँ हिस्सा बीतला से पहिले। ऐप स्मार्त तारीख, अलग होखला पर वैष्णव तारीख, हरि वासर के अंत आ पारन के समय-खिड़की देखावेला।"},
  {"id":"vrat-pradosh","rule":"Pradosh is the day the thirteenth tithi prevails at pradosh kala, the first tenth of the night after sunset, and is named by its weekday (Soma, Bhauma, Shani Pradosh).","source":"Dharmasindhu","level":1,"review":"draft","text":"प्रदोष महीना में दू बेर, हर पक्ष के त्रयोदशी के राखल जाला आ शिव खातिर होला। महत्व साँझ के बा: तेरहवाँ तिथि प्रदोष काल में, माने सूर्यास्त के बाद रात के लगभग पहिला दसवाँ हिस्सा में, चलत होखे के चाहीं, एह से तारीख ओह दिन से अलग हो सकेला जेकरा सूर्योदय पर त्रयोदशी होखे। लोग दिन भर हलुक भा पूरा बरत राखेला आ साँझ के पूजा, अभिषेक आ दीया खातिर शिव मंदिर में भा घरे जुटेला। वार से बरत के नाँव पड़ेला: सोमार के सोम प्रदोष, मंगर के भौम, सनिचर के शनि प्रदोष, आ एही तरह। ऐप सूर्यास्त से रात के ओह पहिला दसवाँ हिस्सा के अंत ले के प्रदोष समय-खिड़की देखावेला।"},
  {"id":"vrat-sankashti","rule":"Sankashti Chaturthi is the Krishna fourth tithi on the day it covers moonrise; on a Tuesday it is Angaraki.","source":"Dharmasindhu","level":1,"review":"draft","text":"संकष्टी चतुर्थी कृष्ण पक्ष के चउथा तिथि के गणेश के महीना के बरत होला। बरत दिन भर चलेला आ चंद्र के दरसन भा चंद्र के अरघ दिहला के बाद ही खोलल जाला, एह से दिन चंद्रोदय से चुनल जाला: ओह साँझ चंद्र के उगत घरी चतुर्थी तिथि चलत होखे के चाहीं, जे सूर्योदय वाला चतुर्थी के अगिला दिन भी हो सकेला। साँझ के पूजा, मीठा के भोग आ चंद्र-दरसन से दिन पूरा होला। जब चतुर्थी मंगर के पड़ेला त एकरा अंगारकी संकष्टी कहल जाला आ एकरा खास महत्व दिहल जाला। ऐप राउर जगह के चंद्रोदय समय देखावेला, काहे कि ई शहर-शहर में कई मिनट बदल जाला।"},
  {"id":"vrat-vinayakaChaturthi","rule":"Vinayaka Chaturthi is the Shukla fourth tithi on the day it covers midday (madhyahna).","source":"Dharmasindhu","level":1,"review":"draft","text":"विनायक चतुर्थी संकष्टी के शुक्ल पक्ष वाला रूप होला, जे हर चांद्र महीना में एक बेर शुक्ल चतुर्थी के राखल जाला। गणेश के पूजा मध्याह्न (दुपहरिया) में होला, एह से तारीख ऊ दिन होला जवना दिन चतुर्थी तिथि मध्याह्न पर होखे, जेकरा एहिजा सूर्योदय से आधा दिनमान बीतला पर लिहल गइल बा। घरे दूब, फूल आ मोदक भा कवनो दूसर मिठाई के संगे सादा पूजा, गणेश कथा के पाठ आ दिन भर के हलुक बरत आम विधि बा। परंपरा से कई परिवार एह रात चंद्र के देखे से बचेला। भादो शुक्ल चतुर्थी साल के गनेस चउथ होला। ऐप ओह दिन के मध्याह्न समय-खिड़की देखावेला।"},
  {"id":"vrat-masikShivaratri","rule":"Masik Shivaratri is the Krishna fourteenth tithi on the night it covers midnight (nishita).","source":"Dharmasindhu","level":1,"review":"draft","text":"मासिक शिवरात्रि कृष्ण चतुर्दशी के, माने अमावस्या से पहिले के रात, शिव के महीना के रात होला। पूजा निशीथ (अधरतिया) में होला, एह से तारीख ऊ कैलेंडर दिन होला जेकरा बाद के अधरतिया चतुर्दशी तिथि के भीतर पड़े, जरूरी नइखे कि ऊ दिन होखे जेकरा सूर्योदय पर ई तिथि होखे। दिन हलुक बरत के संगे राखल जाला; साँझ आ रात पानी, दूध आ बेलपत्र से अभिषेक, दीया आ शिव मंत्र के जप में बीतेला, अक्सर रात के चार पहर में। फागुन कृष्ण चतुर्दशी साल के महाशिवरात्रि होला। ऐप निशीथ समय-खिड़की देखावेला, अधरतिया के दुनो ओर लगभग 24 मिनट।"},
  {"id":"vrat-purnima","rule":"The Purnima vrat is kept on the day the full-moon tithi prevails at moonrise, when the fast is broken.","source":"Dharmasindhu","level":1,"review":"draft","text":"पूर्णिमा बरत पूर्णिमा के दिन के महीना के बरत होला, जेकरा कई परिवार विष्णु भा कुल देवता खातिर राखेला। बरत भोरे शुरू होला आ चंद्रोदय के बाद, पूरा चंद्र के दरसन आ उनका के पानी चढ़वला पर, खतम होला, एह से बरत के तारीख ऊ दिन होला जवना दिन चंद्रोदय पर पूर्णिमा तिथि अबहीं चलत होखे। दिन में नहान, दान आ अक्सर साँझ के सत्यनारायण कथा भी होला। कई नाँव वाला पर्व पूर्णिमा पर पड़ेला: ओह में गुरु पुर्निमा, सरद पुर्निमा, कातिक पुर्निमा आ बुद्ध पुर्निमा बा। ऐप चंद्रोदय के समय आ पूर्णिमा तिथि के अंत देखावेला, जेसे दुनो के तुलना कइल जा सके।"},
  {"id":"vrat-amavasya","rule":"Amavasya observances are kept on the day the new-moon tithi prevails at sunrise.","source":"Dharmasindhu","level":1,"review":"draft","text":"अमावस्या, नया चंद्र के दिन, पुरखा लोग के दिन होला। बरत-पर्व ओह दिन राखल जाला जेकरा सूर्योदय पर अमावस्या तिथि होखे; अपराह्न (दुपहरिया के बाद) तर्पण आ श्राद्ध के समय होला, माने जे लोग पहिले जा चुकल बा ओह लोग के पानी आ खाना के सादा चढ़ावा। ढेर लोग बरत राखेला भा एक बेर खाना खाला, नदी भा मंदिर जाला, आ साँझ के पीपर के गाछ तर दीया जरावेला। कुछ अमावस्या के आपन नाँव आ रिवाज बा: माघ के मौनी अमावस आपन मौन के संगे, जेठ के शनि जयंती, पितर पख के अंत के पितर अमावस (सर्वपितृ अमावस्या), आ दियरी खुदे। ऐप हर महीना के तारीख आ अपराह्न समय-खिड़की देखावेला।"},
  {"id":"vrat-karwaChauth","rule":"Karwa Chauth is Kartik Krishna Chaturthi on the day it covers moonrise; the fast runs from sunrise to that moonrise.","source":"Dharmasindhu","level":1,"review":"draft","text":"करवा चउथ पूर्णिमांत गिनती में कातिक कृष्ण चतुर्थी के राखल जाला, दियरी से लगभग नौ दिन पहिले। जे लोग एकरा राखेला ऊ सूर्योदय से चंद्रोदय ले बिना अन्न-पानी बरत करेला, परंपरा से जीवनसाथी के लमहर उमिर खातिर। दिन भोर से पहिले सरगी से शुरू होला, आ साँझ सामूहिक पूजा, करवा चउथ के कथा आ करवा के अदला-बदली ले आवेला। बरत चंद्र के उगला आ उनका के चलनी से देखला के बाद खतम होला, जवना में पहिला पानी आ खाना जीवनसाथी के हाथ से मिलेला, एह से सही स्थानीय चंद्रोदय ही ऊ समय होला जेकर सभे बाट जोहेला। ऐप राउर जगह के चंद्रोदय देखावेला, जे टीवी पर बतावल समय से कई मिनट अलग हो सकेला।"},
  {"id":"vrat-chhath","rule":"Chhath is Kartik Shukla Shashthi at sunrise, with Nahay Khay on Chaturthi, Kharna on Panchami, the evening arghya at sunset on Shashthi and the morning arghya at the next sunrise.","source":"convention","level":1,"review":"draft","text":"छठ सूरज आ छठी मइया के चार दिन के पूजा होला, जे बिहार, पूरबी उत्तर प्रदेश आ जहाँ-जहाँ भोजपुरिया परिवार रहेला ओहिजा राखल जाला। पहिला दिन, चतुर्थी के नहाय खाय, नहान आ एक सादा खाना होला। दूसरा दिन, पंचमी के खरना, दिन भर के बरत होला जे साँझ ढलत खीर आ रोटी से खोलल जाला, जेकरा बाद मुख्य बरत शुरू होला। तीसरा दिन, षष्ठी, संझा अरघ के होला: सूर्यास्त पर नदी भा पोखरा में खड़ा होके, फल, ठेकुआ आ ऊख के बाँस के दउरा के संगे। चउथा दिन सप्तमी के भोरे उगत सूरज के भोर के अरघ के संगे पूरा होला, जेकरा बाद बरत खोलल जाला। ऐप राउर जगह पर हर अरघ खातिर सूर्यास्त आ सूर्योदय के समय देखावेला।"},
  {"id":"vrat-teej","rule":"Hariyali Teej is Shravana Shukla Tritiya, Kajari Teej Bhadrapada Krishna Tritiya and Hartalika Teej Bhadrapada Shukla Tritiya (Purnimanta names), each on the day whose sunrise has the tithi.","source":"Dharmasindhu","level":1,"review":"draft","text":"तीज बरसात के तीन तृतीया पर्व के नाँव होला, हर एक ओह दिन राखल जाला जेकरा सूर्योदय पर तीसरा तिथि होखे। सावन शुक्ल पक्ष के हरियाली तीज झूला, गीत आ मेहँदी के हरियर पर्व होला। भादो कृष्ण पक्ष के कजरी तीज लोकगीत आ नीम के गाछ के पूजा ले आवेला। भादो शुक्ल पक्ष के हरतालिका तीज, गनेस चउथ से एक दिन पहिले, सबसे कड़ा होला: भोरे से अगिला भोर ले बिना पानी के बरत, साँझ के बालू भा माटी से बनल शिव-पार्वती के पूजा आ कथा के रात। जे लोग एकरा राखेला ऊ आपन बियाह भा घर-परिवार के कुशल-क्षेम खातिर राखेला। ऐप तीनो तारीख देखावेला।"},
  {"id":"vrat-navratri","rule":"Navratri runs the nine days from Pratipada in Chaitra or Ashwin Shukla paksha; Ghatasthapana is done in the Pratipada while it runs after sunrise, or in Abhijit when it ends early.","source":"Dharmasindhu","level":1,"review":"draft","text":"नवरात्र देवी के नौ रात के पूजा होला, जे साल में दू बेर चइत आ आसिन के शुक्ल पक्ष में प्रतिपदा से नवमी ले राखल जाला। एकर शुरुआत घटस्थापना से होला, माने कलश बइठावल आ जौ बोअल, जे तब कइल जाला जब प्रतिपदा तिथि सूर्योदय के बाद अबहीं चलत होखे, भा जब ऊ जल्दी खतम हो जाए त दुपहरिया के आसपास अभिजित मुहूर्त में। हर दिन दुर्गा के एक रूप के पूजा होला; ढेर लोग फल, दूध आ बिना अन्न के फलाहार पर बरत राखेला, दुर्गा सप्तशती के पाठ करेला आ अखंड दीया जरावेला। अष्टमी आ नवमी के कन्या पूजा आ हवन होला, आ शारदीय नवरात्र दशमी के दसहरा के संगे खतम होला। ऐप हर नवरात्र खातिर घटस्थापना के समय-खिड़की आ दिन के गिनती देखावेला।"},
  {"id":"vrat-satyanarayan","rule":"The Satyanarayan vrat is kept on the Purnima day whose evening (sunset) still has the full-moon tithi, otherwise on the day it is at sunrise.","source":"convention","level":1,"review":"draft","text":"सत्यनारायण बरत सत्यनारायण रूप में विष्णु के साँझ के पूजा होला, जे बेसी पूर्णिमा के राखल जाला आ नया घर, बियाह भा कवनो शुभ खबर खातिर चुनल तारीख पर भी। एकर केंद्र कथा बा, पाँच अध्याय के कहानी जे परिवार आ पड़ोसी लोग के सुनावल जाला, जेकरा बाद पंचामृत आ आटा के प्रसाद के भोग आ एक संगे खाना होला। पूजा साँझ के होला, एह से तारीख ऊ पूर्णिमा के दिन होला जवना दिन सूर्यास्त पर पूर्णिमा तिथि अबहीं चलत होखे; जब ऊ सूर्यास्त से पहिले खतम हो जाए, त ओकरा जगह ऊ दिन लिहल जाला जेकरा सूर्योदय पर पूर्णिमा होखे। जे लोग एकरा राखेला ऊ अक्सर कथा पूरा होखे ले बरत राखेला। ऐप सूर्यास्त के संगे पूर्णिमा के अंत के समय देखावेला।"}
]
