[
  {"id":"mangal-dosha","rule":"mangal-dosha","source":"convention","level":1,"review":"draft","params":["present","effective","cancelled","references","marsSign","marsHouse","houses","lagnaUnknown"],"text":"इस कुंडली में मंगल दोष मौजूद है, क्योंकि मंगल लग्न से, चंद्र से या शुक्र से गिनने पर पहले, दूसरे, चौथे, सातवें, आठवें या बारहवें भाव में हैं; “क्यों?” के इनपुट बताते हैं कि तीन संदर्भों में से कौन-से लागू होते हैं। परंपरा इन स्थितियों को एक स्पष्टवादी, स्वतंत्र स्वभाव के लिए पढ़ती है जिसके लिए साझेदारी में जगह बनानी पड़ती है, और आम चलन एक कुंडली को अकेले पढ़ने के बजाय दोनों कुंडलियों की तुलना करना है। हर निरस्ति-नियम अपनी अलग पंक्ति में दिखता है, और दोष को प्रभावी तभी कहा जाता है जब कोई भी लागू न हो। जन्म समय अज्ञात होने पर लग्न वाला संदर्भ छोड़ दिया जाता है और परिणाम पर “लगभग” का टैग लगता है।"},
  {"id":"mangal-dosha-none","rule":"mangal-dosha","source":"convention","level":1,"review":"draft","params":["present","effective","cancelled","references","marsSign","marsHouse","houses","lagnaUnknown"],"text":"इस कुंडली में मंगल दोष मौजूद नहीं है: मंगल लग्न से, चंद्र से या शुक्र से गिनने पर पहले, दूसरे, चौथे, सातवें, आठवें या बारहवें भाव में नहीं हैं। “क्यों?” के इनपुट मंगल की राशि और हर संदर्भ से उनका भाव दिखाते हैं, ताकि परिणाम जाँचा जा सके। नियम लग्न पर निर्भर है, इसलिए जन्म समय अज्ञात वाली कुंडली केवल चंद्र और शुक्र से आँकी जाती है और उस पर “लगभग” का टैग लगता है। निरस्ति-नियमों की पंक्तियाँ फिर भी सूचीबद्ध रहती हैं, ताकि मिलान की दोनों कुंडलियाँ एक ही नियमों से पढ़ी जाएँ।"},
  {"id":"mangal-cancel-own-exalted","rule":"mangal-cancel-own-exalted","source":"convention","level":1,"review":"draft","params":["marsSign","dignity"],"text":"यह निरस्ति लागू होती है क्योंकि मंगल अपनी राशि, मेष या वृश्चिक, में या अपनी उच्च राशि, मकर, में हैं। अपनी राशि में या उच्च के मंगल अशांत के बजाय स्थिर पढ़े जाते हैं, और आम नियम मानता है कि तब दोष वाले भाव में उनकी स्थिति मंगल दोष नहीं गिनी जाती। पंक्ति मंगल की राशि और बल-स्थिति दिखाती है, वही बल-स्थिति जो ग्रह तालिका में छपती है। बाकी निरस्ति-पंक्तियों के साथ मिलकर यह तय करती है कि दोष को प्रभावी कहा जाए या नहीं।"},
  {"id":"mangal-cancel-sign-house","rule":"mangal-cancel-sign-house","source":"convention","level":1,"review":"draft","params":["marsSign","marsHouse"],"text":"यह निरस्ति लागू होती है क्योंकि मंगल उन राशि-भाव युग्मों में से एक में हैं जिन्हें पंचांग छूट देते हैं: पहले भाव में मेष, चौथे में वृश्चिक, सातवें में मकर, आठवें में कर्क या बारहवें में धनु। हर युग्म में राशि को उस बात को नरम करने वाली माना जाता है जो भाव अकेले मंगल के लिए कहता, इसलिए दोष नहीं गिना जाता। पंक्ति मिली हुई राशि और भाव दिखाती है, लग्न से गिने हुए, और इसीलिए जन्म समय अज्ञात होने पर यह नियम छोड़ दिया जाता है।"},
  {"id":"mangal-cancel-jupiter-moon-conjunction","rule":"mangal-cancel-jupiter-moon-conjunction","source":"convention","level":1,"review":"draft","params":["withJupiter","withMoon"],"text":"यह निरस्ति लागू होती है क्योंकि मंगल गुरु या चंद्र के साथ एक ही राशि में हैं। गुरु का साथ मंगल को विवेक से थामने वाला पढ़ा जाता है, और चंद्र का साथ उन्हें भावना से नरम करने वाला, इसलिए इन दोनों में से किसी के साथ का मंगल मंगल दोष देने वाला नहीं गिना जाता। पंक्ति दिखाती है कि दोनों में से कौन ग्रह मंगल के साथ है। यह नियम केवल ग्रहों की राशियाँ देखता है, इसलिए जन्म समय अज्ञात होने पर भी समान रूप से लागू होता है।"},
  {"id":"mangal-cancel-jupiter-aspect","rule":"mangal-cancel-jupiter-aspect","source":"convention","level":1,"review":"draft","params":["marsFromJupiter"],"text":"यह निरस्ति लागू होती है क्योंकि गुरु की दृष्टि मंगल पर है: मंगल गुरु से गिनने पर पाँचवीं, सातवीं या नौवीं राशि में हैं, जो पराशर की तालिका के अनुसार गुरु की पूर्ण दृष्टियाँ हैं। दृष्टि में आया मंगल अपने हाल पर छोड़े हुए के बजाय मार्गदर्शन में पढ़ा जाता है, और दोष नहीं गिना जाता। पंक्ति गुरु से मंगल की दूरी दिखाती है। नियम केवल राशियों पर काम करता है, इसलिए जन्म समय ज्ञात हो या नहीं, यह लागू होता है।"},
  {"id":"mangal-cancel-debilitated-combust","rule":"mangal-cancel-debilitated-combust","source":"convention","level":1,"review":"draft","params":["debilitated","combust"],"text":"यह निरस्ति लागू होती है क्योंकि मंगल नीच हैं, यानी कर्क में, या अस्त हैं, यानी सूर्य से अपनी अस्त-सीमा के भीतर। जो मंगल अपने सामान्य बल में नहीं हैं, उन्हें दोष देने में असमर्थ माना जाता है, इसलिए यह स्थिति नहीं गिनी जाती। पंक्ति दिखाती है कि कौन-सी शर्त पूरी हुई, वही नीच और अस्त टैग जो ग्रह तालिका में हैं। यह नियम केवल राशि और सूर्य से दूरी पढ़ता है, इसलिए जन्म समय पर निर्भर नहीं है।"},
  {"id":"mangal-cancel-both-manglik","rule":"mangal-cancel-both-manglik","source":"convention","level":1,"review":"draft","params":["aEffective","bEffective"],"text":"यह पंक्ति लागू होती है क्योंकि बाकी हर नियम जाँचने के बाद दोनों कुंडलियों में प्रभावी मंगल दोष है। परंपरा दो मांगलिक कुंडलियों को एक-दूसरे को संतुलित करने वाली पढ़ती है, यही शास्त्रीय परस्पर निरस्ति है, इसलिए जोड़ी को संतुलित दिखाया जाता है, न कि एक पक्ष को अलग करके। पंक्ति हर पक्ष का परिणाम बताती है। जब केवल एक कुंडली में दोष हो, तो पंक्ति “लागू नहीं” दिखाती है और सार साफ़ बताता है कि यह किस कुंडली के बारे में है।"}
]
